{
  "exportedAtMs": 1781136739637,
  "version": 1,
  "gymSessions": [
    {
      "id": 24,
      "startedAtMs": 1780998860478,
      "endedAtMs": 1781000640000,
      "freeDay": false,
      "sets": [
        {
          "exerciseName": "Cross Body Tricep Extension",
          "setIndex": 0,
          "weightKg": 0
        },
        {
          "exerciseName": "Cross Body Tricep Extension",
          "setIndex": 1,
          "weightKg": 0
        },
        {
          "exerciseName": "Cross Body Tricep Extension",
          "setIndex": 2,
          "weightKg": 0
        },
        {
          "exerciseName": "Lat Pulldown",
          "setIndex": 0,
          "reps": 6,
          "weightKg": 59,
          "loggedAtMs": 1780999613619
        },
        {
          "exerciseName": "Lat Pulldown",
          "setIndex": 1,
          "reps": 6,
          "weightKg": 59,
          "loggedAtMs": 1780999615656
        },
        {
          "exerciseName": "Lat Pulldown",
          "setIndex": 2,
          "reps": 6,
          "weightKg": 0
        },
        {
          "exerciseName": "Lateral Raise",
          "setIndex": 0,
          "reps": 6,
          "weightKg": 12.5,
          "loggedAtMs": 1781000308800
        },
        {
          "exerciseName": "Lateral Raise",
          "setIndex": 1,
          "reps": 6,
          "weightKg": 12.5,
          "loggedAtMs": 1781000581208
        },
        {
          "exerciseName": "Lateral Raise",
          "setIndex": 2,
          "reps": 6,
          "weightKg": 12.5,
          "loggedAtMs": 1781000584714
        },
        {
          "exerciseName": "Machine Chest Press",
          "setIndex": 0,
          "reps": 6,
          "weightKg": 60,
          "loggedAtMs": 1780999331109
        },
        {
          "exerciseName": "Machine Chest Press",
          "setIndex": 1,
          "reps": 6,
          "weightKg": 65,
          "loggedAtMs": 1780999333097
        },
        {
          "exerciseName": "Machine Chest Press",
          "setIndex": 2,
          "reps": 6,
          "weightKg": 65,
          "loggedAtMs": 1780999334695
        },
        {
          "exerciseName": "Overhead Shoulder Press",
          "setIndex": 0,
          "reps": 5,
          "weightKg": 17.5,
          "loggedAtMs": 1781000072072
        },
        {
          "exerciseName": "Overhead Shoulder Press",
          "setIndex": 1,
          "reps": 6,
          "weightKg": 17.5,
          "loggedAtMs": 1781000076298
        },
        {
          "exerciseName": "Overhead Shoulder Press",
          "setIndex": 2,
          "reps": 6,
          "weightKg": 17.5,
          "loggedAtMs": 1781000238397
        }
      ]
    },
    {
      "id": 22,
      "startedAtMs": 1780803435851,
      "endedAtMs": 1780806600000,
      "freeDay": false,
      "sets": [
        {
          "exerciseName": "Hip Thrust",
          "setIndex": 0,
          "reps": 8,
          "weightKg": 100,
          "loggedAtMs": 1780804884487
        },
        {
          "exerciseName": "Hip Thrust",
          "setIndex": 1,
          "reps": 6,
          "weightKg": 110,
          "loggedAtMs": 1780805188322
        },
        {
          "exerciseName": "Hip Thrust",
          "setIndex": 2,
          "reps": 6,
          "weightKg": 110,
          "loggedAtMs": 1780805368095
        },
        {
          "exerciseName": "Leg Extension",
          "setIndex": 0,
          "reps": 6,
          "weightKg": 95,
          "loggedAtMs": 1780803541914
        },
        {
          "exerciseName": "Leg Extension",
          "setIndex": 1,
          "reps": 6,
          "weightKg": 100,
          "loggedAtMs": 1780803712449
        },
        {
          "exerciseName": "Leg Extension",
          "setIndex": 2,
          "reps": 7,
          "weightKg": 100,
          "loggedAtMs": 1780803949692
        },
        {
          "exerciseName": "Overhead Tricep Extension",
          "setIndex": 0,
          "reps": 5,
          "weightKg": 20,
          "loggedAtMs": 1780805908066
        },
        {
          "exerciseName": "Overhead Tricep Extension",
          "setIndex": 1,
          "reps": 5,
          "weightKg": 20,
          "loggedAtMs": 1780805989788
        },
        {
          "exerciseName": "Overhead Tricep Extension",
          "setIndex": 2,
          "reps": 4,
          "weightKg": 20,
          "loggedAtMs": 1780806161499
        },
        {
          "exerciseName": "Seated Leg Curl",
          "setIndex": 0,
          "reps": 8,
          "weightKg": 75,
          "loggedAtMs": 1780804110606
        },
        {
          "exerciseName": "Seated Leg Curl",
          "setIndex": 1,
          "reps": 6,
          "weightKg": 80,
          "loggedAtMs": 1780804320349
        },
        {
          "exerciseName": "Seated Leg Curl",
          "setIndex": 2,
          "reps": 5,
          "weightKg": 80,
          "loggedAtMs": 1780804564679
        },
        {
          "exerciseName": "Standing Calf Raise",
          "setIndex": 0,
          "reps": 5,
          "weightKg": 55,
          "loggedAtMs": 1780806291027
        },
        {
          "exerciseName": "Standing Calf Raise",
          "setIndex": 1,
          "reps": 6,
          "weightKg": 55,
          "loggedAtMs": 1780806462455
        },
        {
          "exerciseName": "Standing Calf Raise",
          "setIndex": 2,
          "reps": 5,
          "weightKg": 60,
          "loggedAtMs": 1780806646639
        }
      ]
    },
    {
      "id": 21,
      "startedAtMs": 1780715428279,
      "endedAtMs": 1780717320000,
      "freeDay": false,
      "sets": [
        {
          "exerciseName": "Bench Press (Dumbbell\/Barbell)",
          "setIndex": 0,
          "reps": 5,
          "weightKg": 60,
          "loggedAtMs": 1780715729118
        },
        {
          "exerciseName": "Bench Press (Dumbbell\/Barbell)",
          "setIndex": 1,
          "reps": 2,
          "weightKg": 70,
          "loggedAtMs": 1780715853594
        },
        {
          "exerciseName": "Bench Press (Dumbbell\/Barbell)",
          "setIndex": 2,
          "reps": 1,
          "weightKg": 70,
          "loggedAtMs": 1780716273449
        },
        {
          "exerciseName": "Bicep Curl",
          "setIndex": 0,
          "reps": 6,
          "weightKg": 15,
          "loggedAtMs": 1780716429003
        },
        {
          "exerciseName": "Bicep Curl",
          "setIndex": 1,
          "reps": 3,
          "weightKg": 15,
          "loggedAtMs": 1780716798836
        },
        {
          "exerciseName": "Bicep Curl",
          "setIndex": 2,
          "reps": 6,
          "weightKg": 12.5,
          "loggedAtMs": 1780716800934
        },
        {
          "exerciseName": "Cross Body Tricep Extension",
          "setIndex": 0,
          "weightKg": 0
        },
        {
          "exerciseName": "Cross Body Tricep Extension",
          "setIndex": 1,
          "weightKg": 0
        },
        {
          "exerciseName": "Cross Body Tricep Extension",
          "setIndex": 2,
          "weightKg": 0
        },
        {
          "exerciseName": "Seated Row",
          "setIndex": 0,
          "reps": 7,
          "weightKg": 55,
          "loggedAtMs": 1780717028626
        },
        {
          "exerciseName": "Seated Row",
          "setIndex": 1,
          "reps": 8,
          "weightKg": 55,
          "loggedAtMs": 1780717159513
        },
        {
          "exerciseName": "Seated Row",
          "setIndex": 2,
          "reps": 3,
          "weightKg": 65,
          "loggedAtMs": 1780717322743
        }
      ]
    },
    {
      "id": 20,
      "startedAtMs": 1780548970724,
      "endedAtMs": 1780551660000,
      "freeDay": false,
      "sets": [
        {
          "exerciseName": "Ab Crunch",
          "setIndex": 0,
          "reps": 8,
          "weightKg": 35,
          "loggedAtMs": 1780550677827
        },
        {
          "exerciseName": "Ab Crunch",
          "setIndex": 1,
          "reps": 6,
          "weightKg": 35,
          "loggedAtMs": 1780550897617
        },
        {
          "exerciseName": "Ab Crunch",
          "setIndex": 2,
          "reps": 6,
          "weightKg": 30,
          "loggedAtMs": 1780551114757
        },
        {
          "exerciseName": "Barbell Back Squat",
          "setIndex": 0,
          "reps": 6,
          "weightKg": 100,
          "loggedAtMs": 1780549472163
        },
        {
          "exerciseName": "Barbell Back Squat",
          "setIndex": 1,
          "reps": 4,
          "weightKg": 110,
          "loggedAtMs": 1780549692190
        },
        {
          "exerciseName": "Barbell Back Squat",
          "setIndex": 2,
          "reps": 4,
          "weightKg": 110,
          "loggedAtMs": 1780550044915
        },
        {
          "exerciseName": "Cable Hip Flexor",
          "setIndex": 0,
          "reps": 6,
          "weightKg": 15,
          "loggedAtMs": 1780551289358
        },
        {
          "exerciseName": "Cable Hip Flexor",
          "setIndex": 1,
          "reps": 5,
          "weightKg": 17.5,
          "loggedAtMs": 1780551519458
        },
        {
          "exerciseName": "Cable Hip Flexor",
          "setIndex": 2,
          "reps": 6,
          "weightKg": 17.5,
          "loggedAtMs": 1780551696923
        },
        {
          "exerciseName": "RDL",
          "setIndex": 0,
          "reps": 6,
          "weightKg": 60,
          "loggedAtMs": 1780550143764
        },
        {
          "exerciseName": "RDL",
          "setIndex": 1,
          "reps": 6,
          "weightKg": 60,
          "loggedAtMs": 1780550333487
        },
        {
          "exerciseName": "RDL",
          "setIndex": 2,
          "reps": 3,
          "weightKg": 80,
          "loggedAtMs": 1780550574157
        }
      ]
    },
    {
      "id": 19,
      "startedAtMs": 1780370271542,
      "endedAtMs": 1780374900000,
      "freeDay": true,